{
  "$schema": "https://forge-h2.local/schema/formula-library.schema.json",
  "project_id": "FHZ-ENTERPRISE-001",
  "library_version": "1.1.0",
  "source": {
    "source_kind": "user_provided",
    "publisher": "Forge H2 — 수소플랜트 공식 확장본 (초안)",
    "locator": "세션 검증 계산기에서 유도. 출처 문헌·기준 확인 필요",
    "evidence_ids": [
      "EVD-H2-FORMULAS-PENDING"
    ]
  },
  "execution_policy": {
    "allowed_language": "python_expression",
    "allow_dynamic_code": false,
    "requires_unit_check": true
  },
  "reference_values": {
    "H2_LHV_KWH_PER_KG": {
      "value": 33.322,
      "unit": "kWh/kg",
      "source_knowledge_id": "KNW-H2-PLANT-BASELINE",
      "evidence_id": "EVD-H2-FORMULAS-PENDING",
      "verification_status": "machine_checked",
      "promotion_status": "pending_authority_confirmation"
    }
  },
  "formulas": [
    {
      "formula_id": "FML-H2-001",
      "domain": "hydrogen_balance",
      "name": "발전출력 기준 수소 소비량",
      "equation_latex": "\\dot m_{H_2} = \\frac{P_{gross}}{\\eta_{el}\\,LHV_{H_2}}",
      "equation_ascii": "m_H2 = P_gross_kW / (eta_el * LHV)",
      "solved_for": "m_H2",
      "python": {
        "call_signature": "h2_flow_from_power(P_gross_kW, eta_el, LHV)",
        "expression": "P_gross_kW / (eta_el * LHV)"
      },
      "variables": [
        {
          "symbol": "P_gross_kW",
          "meaning": "총발전단 출력",
          "unit": "kW"
        },
        {
          "symbol": "eta_el",
          "meaning": "발전효율 (LHV 기준, 소수)",
          "unit": "dimensionless"
        },
        {
          "symbol": "LHV",
          "meaning": "수소 저위발열량",
          "unit": "kWh/kg"
        }
      ],
      "assumptions": [
        "효율은 총발전단(Gross AC) 기준이다. 순출력을 넣으면 수소량이 과소산정된다.",
        "LHV 기준. HHV 를 쓰려면 39.394 kWh/kg 로 바꾸고 효율 기준도 함께 바꿔야 한다.",
        "정상상태·정격운전. 기동·정지·부분부하 손실은 포함하지 않는다."
      ],
      "source_knowledge_id": "KNW-H2-PLANT-BASELINE",
      "verification_status": "machine_checked",
      "validation_cases": [
        {
          "inputs": {
            "P_gross_kW": 20000,
            "eta_el": 0.5,
            "LHV": 33.322
          },
          "expected": 1200.4081387671808
        },
        {
          "inputs": {
            "P_gross_kW": 20000,
            "eta_el": 0.475,
            "LHV": 33.322
          },
          "expected": 1263.5875144917693
        }
      ],
      "sympy": "Eq(m_H2, P_gross_kW/(eta_el*LHV))"
    },
    {
      "formula_id": "FML-H2-002",
      "domain": "hydrogen_balance",
      "name": "총발전단 대비 순출력",
      "equation_latex": "P_{net} = P_{gross}(1-f_{aux})",
      "equation_ascii": "P_net = P_gross_MW * (1 - parasitic)",
      "solved_for": "P_net",
      "python": {
        "call_signature": "net_from_gross(P_gross_MW, parasitic)",
        "expression": "P_gross_MW * (1 - parasitic)"
      },
      "variables": [
        {
          "symbol": "P_gross_MW",
          "meaning": "총발전단 출력",
          "unit": "MW"
        },
        {
          "symbol": "parasitic",
          "meaning": "소내부하율 (소수)",
          "unit": "dimensionless"
        }
      ],
      "assumptions": [
        "소내부하에는 공기공급·냉각·수소계통·제어·기타 소내가 포함된다.",
        "계약상 인도점이 순출력인지 총발전단인지 먼저 확정해야 한다."
      ],
      "source_knowledge_id": "KNW-H2-PLANT-BASELINE",
      "verification_status": "machine_checked",
      "validation_cases": [
        {
          "inputs": {
            "P_gross_MW": 20.0,
            "parasitic": 0.08
          },
          "expected": 18.400000000000002
        }
      ]
    },
    {
      "formula_id": "FML-H2-003",
      "domain": "hydrogen_balance",
      "name": "연간 수소 소요량",
      "equation_latex": "M_{yr} = \\dot m_{H_2}\\cdot 8760\\cdot CF/1000",
      "equation_ascii": "M_t_yr = m_H2 * 8760 * cf / 1000",
      "solved_for": "M_t_yr",
      "python": {
        "call_signature": "annual_h2(m_H2, cf)",
        "expression": "m_H2 * 8760 * cf / 1000"
      },
      "variables": [
        {
          "symbol": "m_H2",
          "meaning": "수소 소비량",
          "unit": "kg/h"
        },
        {
          "symbol": "cf",
          "meaning": "이용률 (소수)",
          "unit": "dimensionless"
        }
      ],
      "assumptions": [
        "이용률은 계획 정지·강제 정지를 반영한 연간 평균이다.",
        "공급계약 Take-or-Pay 물량 산정의 입력이 된다."
      ],
      "source_knowledge_id": "KNW-H2-PLANT-BASELINE",
      "verification_status": "machine_checked",
      "validation_cases": [
        {
          "inputs": {
            "m_H2": 1200.0,
            "cf": 0.9
          },
          "expected": 9460.8
        }
      ]
    },
    {
      "formula_id": "FML-H2-004",
      "domain": "hydrogen_balance",
      "name": "단위 발전량당 수소 소비율",
      "equation_latex": "SFC = \\dot m_{H_2}/P_{gross}",
      "equation_ascii": "sfc = m_H2 / P_gross_MW",
      "solved_for": "sfc",
      "python": {
        "call_signature": "specific_fuel_consumption(m_H2, P_gross_MW)",
        "expression": "m_H2 / P_gross_MW"
      },
      "variables": [
        {
          "symbol": "m_H2",
          "meaning": "수소 소비량",
          "unit": "kg/h"
        },
        {
          "symbol": "P_gross_MW",
          "meaning": "총발전단 출력",
          "unit": "MW"
        }
      ],
      "assumptions": [
        "성능보증 판정과 벤더 비교의 공통 지표.",
        "1/(eta*LHV) 와 동치이므로 효율 기준이 다르면 비교 불가."
      ],
      "source_knowledge_id": "KNW-H2-PLANT-BASELINE",
      "verification_status": "machine_checked",
      "validation_cases": [
        {
          "inputs": {
            "m_H2": 1200.0,
            "P_gross_MW": 20.0
          },
          "expected": 60.0
        }
      ]
    },
    {
      "formula_id": "FML-H2-005",
      "domain": "hydrogen_storage",
      "name": "필요 저장량 (사용가능 잔압 반영)",
      "equation_latex": "S = \\frac{\\dot m_{H_2}\\cdot 24\\cdot CF\\cdot d}{u}",
      "equation_ascii": "S_kg = m_H2 * 24 * cf * autonomy_day / usable",
      "solved_for": "S_kg",
      "python": {
        "call_signature": "storage_required(m_H2, cf, autonomy_day, usable)",
        "expression": "m_H2 * 24 * cf * autonomy_day / usable"
      },
      "variables": [
        {
          "symbol": "m_H2",
          "meaning": "수소 소비량",
          "unit": "kg/h"
        },
        {
          "symbol": "cf",
          "meaning": "이용률 (소수)",
          "unit": "dimensionless"
        },
        {
          "symbol": "autonomy_day",
          "meaning": "자립일수",
          "unit": "day"
        },
        {
          "symbol": "usable",
          "meaning": "사용가능 비율 (잔압 제외, 소수)",
          "unit": "dimensionless"
        }
      ],
      "assumptions": [
        "usable 을 1.0 으로 두면 잔압분을 무시해 저장설비가 과소산정된다.",
        "압축가스 저장은 통상 0.7–0.85. 실제값은 공급압력·최소사용압력으로 결정한다.",
        "자립일수 정책은 공급중단 시나리오(M-038 계열)와 일치해야 한다."
      ],
      "source_knowledge_id": "KNW-H2-PLANT-BASELINE",
      "verification_status": "machine_checked",
      "validation_cases": [
        {
          "inputs": {
            "m_H2": 1200.0,
            "cf": 0.9,
            "autonomy_day": 2.0,
            "usable": 0.8
          },
          "expected": 64800.0
        },
        {
          "inputs": {
            "m_H2": 1200.0,
            "cf": 0.9,
            "autonomy_day": 2.0,
            "usable": 1.0
          },
          "expected": 51840.0
        }
      ]
    },
    {
      "formula_id": "FML-H2-006",
      "domain": "hydrogen_storage",
      "name": "압축수소 저장밀도",
      "equation_latex": "\\rho = \\frac{P}{Z R_s T}",
      "equation_ascii": "rho = P_bar * 1e5 / (RS_H2 * T_K * Z)",
      "solved_for": "rho",
      "python": {
        "call_signature": "h2_density(P_bar, T_K, Z, RS_H2)",
        "expression": "P_bar * 1e5 / (RS_H2 * T_K * Z)"
      },
      "variables": [
        {
          "symbol": "P_bar",
          "meaning": "절대압력",
          "unit": "bar"
        },
        {
          "symbol": "T_K",
          "meaning": "절대온도",
          "unit": "K"
        },
        {
          "symbol": "Z",
          "meaning": "압축계수",
          "unit": "dimensionless"
        },
        {
          "symbol": "RS_H2",
          "meaning": "수소 기체상수",
          "unit": "J/(kg*K)"
        }
      ],
      "assumptions": [
        "수소는 상온 고압에서 Z>1 이라 이상기체로 계산하면 밀도를 과대산정한다.",
        "Z 는 압력·온도별 실측표에서 가져와야 하며 상수로 고정하면 안 된다.",
        "저장밀도 기본값을 근거 없이 쓰면 저장 용적과 부지면적이 함께 틀어진다."
      ],
      "source_knowledge_id": "KNW-H2-PLANT-BASELINE",
      "verification_status": "machine_checked",
      "validation_cases": [
        {
          "inputs": {
            "P_bar": 200.0,
            "T_K": 288.15,
            "Z": 1.1,
            "RS_H2": 4124.2
          },
          "expected": 15.299560970759686
        },
        {
          "inputs": {
            "P_bar": 350.0,
            "T_K": 288.15,
            "Z": 1.2,
            "RS_H2": 4124.2
          },
          "expected": 24.543045723926998
        }
      ]
    },
    {
      "formula_id": "FML-H2-007",
      "domain": "hydrogen_logistics",
      "name": "저장 용기·트레일러 수량",
      "equation_latex": "N = \\lceil S/q \\rceil",
      "equation_ascii": "N = ceil(S_kg / payload_kg)",
      "solved_for": "N",
      "python": {
        "call_signature": "storage_units(S_kg, payload_kg)",
        "expression": "math.ceil(S_kg / payload_kg)"
      },
      "variables": [
        {
          "symbol": "S_kg",
          "meaning": "필요 저장량",
          "unit": "kg"
        },
        {
          "symbol": "payload_kg",
          "meaning": "용기 1대 적재량",
          "unit": "kg"
        }
      ],
      "assumptions": [
        "튜브트레일러 적재량은 압력·용기형식에 따라 크게 달라진다.",
        "수량이 비현실적으로 커지면 공급방식 자체를 재검토해야 한다는 신호다."
      ],
      "source_knowledge_id": "KNW-H2-PLANT-BASELINE",
      "verification_status": "machine_checked",
      "validation_cases": [
        {
          "inputs": {
            "S_kg": 64800.0,
            "payload_kg": 340.0
          },
          "expected": 191
        }
      ]
    },
    {
      "formula_id": "FML-H2-008",
      "domain": "hydrogen_logistics",
      "name": "일일 운송 횟수",